{
  "id": "parallelexec",
  "version": "1.0",
  "name": "Parallel Execution Workflow",
  "description": "Executes two branches in parallel",
  "start": "ParallelExec",
  "states":[
    {
      "name": "ParallelExec",
      "type": "parallel",
      "completionType": "allOf",
      "branches": [
        {
          "name": "ShortDelayBranch"
        },
        {
          "name": "LongDelayBranch"
        }
      ],
      "end": true
    }
  ]
}